Region,City,Name,Address,Phone,Website,Description,Features
Hampshire,Alton,Ready Steady Store Alton,14 Newman Lane Alton Hampshire GU34 2QR,03333 444 222,readysteadystore.com,"Ready Steady Store provides secure self storage in Alton. Clean and modern facility with various unit sizes from 10 sq ft to 200 sq ft with 24/7 access available.",24/7 Access,CCTV,Free Parking,Security Lighting,Drive-up Access
Hampshire,Alton,Lok'nStore Alton,Mill Lane Alton Hampshire GU34 1BD,01420 594455,loknstore.co.uk,"Lok'nStore offers self storage solutions in Alton with flexible contracts and no hidden fees. Clean and secure units with staff on site during business hours.",CCTV,Secure Facility,Free Parking,Staff On Site,Alarmed Units
Hampshire,Alton,Big Yellow Self Storage,Unit 3 Omega Park Alton Hampshire GU34 2QE,01420 549022,bigyellow.co.uk,"Big Yellow Self Storage provides secure storage units in Alton with 24-hour access options. Climate controlled units available for sensitive items.",24/7 Access,Climate Control,CCTV,Loading Bay,Month-to-Month Rental
Greater London,Croydon,Access Self Storage Croydon,50-54 Purley Way Croydon CR0 3JP,020 8686 9999,accessstorage.com,"Access Self Storage Croydon offers clean and secure storage units with 24/7 access. Located on Purley Way with easy transport links.",24/7 Access,CCTV,Loading Bay,Reception Services,Free Parking
Greater London,Croydon,Safestore Croydon Central,81 Purley Way Croydon CR0 4RL,020 8680 8787,safestore.co.uk,"Safestore Croydon Central provides self storage solutions with monitored CCTV and secure individual units. Various sizes from locker to warehouse space.",CCTV,Alarmed Units,Electronic Entry,Business Storage,24/7 Access
Greater London,Croydon,Big Yellow Self Storage Croydon,111 Purley Way Croydon CR0 4NS,020 8681 8181,bigyellow.co.uk,"Big Yellow's Croydon facility offers flexible storage options with climate-controlled units and advanced security. Student discounts available.",Climate Control,CCTV,Security Lighting,Free Parking,Loading Bay
Greater London,Croydon,Shurgard Self-Storage Croydon Purley Way,755 Purley Way Croydon CR9 4AL,020 8684 9990,shurgard.co.uk,"Shurgard Self-Storage on Purley Way offers modern storage units with PIN code access and 24/7 video surveillance. No long-term commitment required.",CCTV,Digital Entry,Free Trolleys,Moving Supplies,Month-to-Month Rental
Greater London,Wembley,Safestore Wembley,Unit 2-4 Wembley Commercial Centre East Lane Wembley HA9 7UR,020 8904 9292,safestore.co.uk,"Safestore Wembley provides secure self storage in various sizes with flexible contracts. Located near Wembley Stadium with good transport links.",CCTV,Electronic Entry,Loading Bay,Free Parking,Business Storage
Greater London,Wembley,Access Self Storage Wembley,290-300 Wembley Park Drive Wembley HA9 8HP,020 8900 9990,accessstorage.com,"Access Self Storage Wembley offers secure storage units with 24/7 access. Located near Wembley Park station with excellent transport links.",24/7 Access,CCTV,Free Parking,Reception Services,Moving Supplies
Greater London,Wembley,Big Yellow Self Storage Wembley,Unit 1 Beresford Avenue Wembley HA0 1NW,020 8782 0033,bigyellow.co.uk,"Big Yellow Wembley provides secure self storage with flexible contracts and no hidden fees. Climate-controlled units available in various sizes.",Climate Control,CCTV,Free Parking,Loading Bay,Security Lighting
Greater London,Romford,Safestore Romford,Eastern Avenue Romford RM1 3NH,01708 742123,safestore.co.uk,"Safestore Romford offers secure self storage with 24-hour CCTV monitoring and individually alarmed units. Flexible storage options for home and business.",CCTV,Alarmed Units,Electronic Entry,Business Storage,Loading Bay
Greater London,Romford,Access Self Storage Romford,Gallows Corner Eastern Avenue Romford RM3 0AS,01708 348600,accessstorage.com,"Access Self Storage Romford provides secure storage units with 24/7 access. Located at Gallows Corner with excellent road links.",24/7 Access,CCTV,Free Parking,Drive-up Access,Reception Services
Greater London,Romford,Big Yellow Self Storage Romford,80 North Street Romford RM1 1DA,01708 742007,bigyellow.co.uk,"Big Yellow Romford offers flexible storage options with premium security and various unit sizes. Easy access from central Romford.",CCTV,Digital Entry,Climate Control,Free Parking,Loading Bay 